{
 "attempts": [
  {
   "body_bytes": 274,
   "body_sha256": "469ecf3122a5aa7d6c83805ba837165ceb13d55fa3c6f5cf182d6314d02f5d43",
   "code": "HTTP_RATE_LIMITED",
   "content_type": "text/plain",
   "detail": "",
   "duration_s": 0.425,
   "number": 1,
   "operation": "source",
   "retry_after_problem": null,
   "retry_after_raw": "49",
   "retry_after_s": 49.0,
   "retryable": true,
   "started_at": "2026-10-29T08:30:10.677284Z",
   "status": 429,
   "url": "https://en.wikipedia.org/w/api.php?action=query&format=json&formatversion=2&prop=revisions%7Cinfo&rvprop=ids%7Ctimestamp%7Cflags%7Csize%7Csha1%7Ccontentmodel%7Ccontent&rvslots=main&maxlag=5&pageids=81119391",
   "wire_bytes": 274
  },
  {
   "body_bytes": 5789,
   "body_sha256": "78cb8cf8148375c2235e8d3417d5b30e2ebb6da472b7fc09bdad0b0856029d07",
   "code": null,
   "content_type": "application/json; charset=utf-8",
   "detail": "",
   "duration_s": 0.47,
   "number": 2,
   "operation": "source",
   "retry_after_problem": null,
   "retry_after_raw": null,
   "retry_after_s": null,
   "retryable": false,
   "started_at": "2026-10-29T08:31:00.103062Z",
   "status": 200,
   "url": "https://en.wikipedia.org/w/api.php?action=query&format=json&formatversion=2&prop=revisions%7Cinfo&rvprop=ids%7Ctimestamp%7Cflags%7Csize%7Csha1%7Ccontentmodel%7Ccontent&rvslots=main&maxlag=5&pageids=81119391",
   "wire_bytes": 2619
  },
  {
   "body_bytes": 1965,
   "body_sha256": "048ac782fb89781d1e80d90f3ffcc9f24e977ca333fb65f7f09d6a1daf198dfb",
   "code": "HTTP_RATE_LIMITED",
   "content_type": "text/html; charset=utf-8",
   "detail": "",
   "duration_s": 0.444,
   "number": 1,
   "operation": "render",
   "retry_after_problem": null,
   "retry_after_raw": "1",
   "retry_after_s": 1.0,
   "retryable": true,
   "started_at": "2026-10-29T08:31:10.574521Z",
   "status": 429,
   "url": "https://en.wikipedia.org/w/rest.php/v1/revision/1316994319/html",
   "wire_bytes": 1965
  },
  {
   "body_bytes": 274,
   "body_sha256": "e8f029eebb121ce4e2515619f36b7ee93e6925fbea43219eaa73ac6f7e624b26",
   "code": "HTTP_RATE_LIMITED",
   "content_type": "text/plain",
   "detail": "",
   "duration_s": 0.419,
   "number": 2,
   "operation": "render",
   "retry_after_problem": null,
   "retry_after_raw": "39",
   "retry_after_s": 39.0,
   "retryable": true,
   "started_at": "2026-10-29T08:31:21.019108Z",
   "status": 429,
   "url": "https://en.wikipedia.org/w/rest.php/v1/revision/1316994319/html",
   "wire_bytes": 274
  },
  {
   "body_bytes": 1965,
   "body_sha256": "2aba03dbfde5cee9b97052755576129c9a791ca26fc44f8d055558aa986bcc98",
   "code": "HTTP_RATE_LIMITED",
   "content_type": "text/html; charset=utf-8",
   "detail": "",
   "duration_s": 0.418,
   "number": 3,
   "operation": "render",
   "retry_after_problem": null,
   "retry_after_raw": "1",
   "retry_after_s": 1.0,
   "retryable": true,
   "started_at": "2026-10-29T08:32:00.438245Z",
   "status": 429,
   "url": "https://en.wikipedia.org/w/rest.php/v1/revision/1316994319/html",
   "wire_bytes": 1965
  }
 ],
 "client": {
  "name": "citerift-wiki",
  "policy": {
   "backoff_s": 10.0,
   "deadline_s": 180.0,
   "max_attempts": 3,
   "max_body_bytes": 33554432,
   "max_wire_bytes": 33554432,
   "maxlag_s": 5,
   "min_interval_s": 10.0,
   "op_timeout_s": 30.0,
   "user_agent": "CITERIFT-wiki/1.0 (https://github.com/ImanOthman-eng/citerift; read-only research; contact via GitHub issues)"
  },
  "version": "1.0.0"
 },
 "failure_artifacts": [
  "469ecf3122a5aa7d6c83805ba837165ceb13d55fa3c6f5cf182d6314d02f5d43",
  "048ac782fb89781d1e80d90f3ffcc9f24e977ca333fb65f7f09d6a1daf198dfb",
  "e8f029eebb121ce4e2515619f36b7ee93e6925fbea43219eaa73ac6f7e624b26",
  "2aba03dbfde5cee9b97052755576129c9a791ca26fc44f8d055558aa986bcc98"
 ],
 "finished_at": "2026-10-29T08:32:00.857021Z",
 "issues": [
  {
   "code": "ATTEMPTS_EXHAUSTED",
   "detail": "render",
   "entities": [],
   "evidence": [],
   "retryable": true,
   "severity": "error"
  }
 ],
 "not_before": null,
 "page": {
  "content_model": "wikitext",
  "host": "en.wikipedia.org",
  "is_latest": true,
  "namespace": 0,
  "page_id": 81119391,
  "parent_revision_id": 1312496127,
  "redirect_followed": null,
  "revision_id": 1316994319,
  "revision_timestamp": "2025-10-15T18:14:39Z",
  "sha1": "0c71db5a186c3561825876c05b44c6b5b8d96d92",
  "size": 5179,
  "title": "Benoitia raymondeae",
  "wiki": "en"
 },
 "render": {
  "code": "ATTEMPTS_EXHAUSTED",
  "not_before": null,
  "state": "failed",
  "url": "https://en.wikipedia.org/w/rest.php/v1/revision/1316994319/html"
 },
 "request": {
  "follow_redirect": false,
  "page_id": 81119391,
  "render": true,
  "revision_id": null,
  "title": null,
  "wiki": "en"
 },
 "schema": "urn:citerift:schema:wiki:v1:capture",
 "schema_version": "1.0.0",
 "source": {
  "artifact": "ab9f435a5314fd1c4275bc9aff02f8e3fdb1b0da95441d0c66fc2cc7e28f9429",
  "bytes": 5179,
  "response_artifact": "78cb8cf8148375c2235e8d3417d5b30e2ebb6da472b7fc09bdad0b0856029d07",
  "url": "https://en.wikipedia.org/w/api.php?action=query&format=json&formatversion=2&prop=revisions%7Cinfo&rvprop=ids%7Ctimestamp%7Cflags%7Csize%7Csha1%7Ccontentmodel%7Ccontent&rvslots=main&maxlag=5&pageids=81119391"
 },
 "started_at": "2026-10-29T08:30:01.029467Z",
 "status": "partial"
}
