{
 "attempts": [
  {
   "body_bytes": 274,
   "body_sha256": "163e0e59f801486b793ee3556dc034fcb2b12c352c17e000681dc7ed7a21238e",
   "code": "HTTP_RATE_LIMITED",
   "content_type": "text/plain",
   "detail": "",
   "duration_s": 0.406,
   "number": 1,
   "operation": "source",
   "retry_after_problem": null,
   "retry_after_raw": "39",
   "retry_after_s": 39.0,
   "retryable": true,
   "started_at": "2026-10-29T08:53:21.282269Z",
   "status": 429,
   "url": "https://en.wikipedia.org/w/api.php?action=query&format=json&formatversion=2&prop=revisions%7Cinfo&rvprop=ids%7Ctimestamp%7Cflags%7Csize%7Csha1%7Ccontentmodel%7Ccontent&rvslots=main&maxlag=5&pageids=1505283",
   "wire_bytes": 274
  },
  {
   "body_bytes": 51720,
   "body_sha256": "bd3f978dc87311ad60a9478e1e6612f9d9e41b83023507b3a1f10015ca80e205",
   "code": null,
   "content_type": "application/json; charset=utf-8",
   "detail": "",
   "duration_s": 0.553,
   "number": 2,
   "operation": "source",
   "retry_after_problem": null,
   "retry_after_raw": null,
   "retry_after_s": null,
   "retryable": false,
   "started_at": "2026-10-29T08:54:00.689072Z",
   "status": 200,
   "url": "https://en.wikipedia.org/w/api.php?action=query&format=json&formatversion=2&prop=revisions%7Cinfo&rvprop=ids%7Ctimestamp%7Cflags%7Csize%7Csha1%7Ccontentmodel%7Ccontent&rvslots=main&maxlag=5&pageids=1505283",
   "wire_bytes": 19513
  },
  {
   "body_bytes": 295135,
   "body_sha256": "01018ff9a30644e3a525666e52e9c8483835cbce49b61e36650af7f119156891",
   "code": null,
   "content_type": "text/html; charset=utf-8; profile=\"https://www.mediawiki.org/wiki/Specs/HTML/2.8.0\"",
   "detail": "",
   "duration_s": 0.544,
   "number": 1,
   "operation": "render",
   "retry_after_problem": null,
   "retry_after_raw": null,
   "retry_after_s": null,
   "retryable": false,
   "started_at": "2026-10-29T08:54:11.243238Z",
   "status": 200,
   "url": "https://en.wikipedia.org/w/rest.php/v1/revision/1340093048/html",
   "wire_bytes": 54237
  }
 ],
 "client": {
  "name": "citerift-wiki",
  "policy": {
   "backoff_s": 10.0,
   "deadline_s": 180.0,
   "max_attempts": 3,
   "max_body_bytes": 33554432,
   "max_wire_bytes": 33554432,
   "maxlag_s": 5,
   "min_interval_s": 10.0,
   "op_timeout_s": 30.0,
   "user_agent": "CITERIFT-wiki/1.0 (https://github.com/ImanOthman-eng/citerift; read-only research; contact via GitHub issues)"
  },
  "version": "1.0.0"
 },
 "failure_artifacts": [
  "163e0e59f801486b793ee3556dc034fcb2b12c352c17e000681dc7ed7a21238e"
 ],
 "finished_at": "2026-10-29T08:54:11.790888Z",
 "issues": [],
 "not_before": null,
 "page": {
  "content_model": "wikitext",
  "host": "en.wikipedia.org",
  "is_latest": true,
  "namespace": 0,
  "page_id": 1505283,
  "parent_revision_id": 1316886172,
  "redirect_followed": null,
  "revision_id": 1340093048,
  "revision_timestamp": "2026-02-23T22:54:52Z",
  "sha1": "bb96f00297d6560045992da074dab81906b8913f",
  "size": 50895,
  "title": "Pleiotropy",
  "wiki": "en"
 },
 "render": {
  "artifact": "01018ff9a30644e3a525666e52e9c8483835cbce49b61e36650af7f119156891",
  "bytes": 295135,
  "checks": {
   "document_revision_id": "1340093048",
   "header_revision_id": "1340093048",
   "html_version": "2.8.0",
   "namespace": "0",
   "page_id": "1505283",
   "render_id": "a599f363-d172-11f1-836b-d9fe84c7ae85",
   "revision_sha1": "bb96f00297d6560045992da074dab81906b8913f",
   "revision_sha1_base36": "lwuoaoo9p5d0nq7vtlfuwnhdk907g3j"
  },
  "headers": {
   "content-language": "en",
   "content-revision-id": "1340093048",
   "content-type": "text/html; charset=utf-8; profile=\"https://www.mediawiki.org/wiki/Specs/HTML/2.8.0\"",
   "date": "Thu, 29 Oct 2026 08:54:11 GMT",
   "etag": "W/\"1340093048/a599f363-d172-11f1-836b-d9fe84c7ae85/view\"",
   "last-modified": "Mon, 26 Oct 2026 19:19:06 GMT"
  },
  "state": "captured",
  "url": "https://en.wikipedia.org/w/rest.php/v1/revision/1340093048/html"
 },
 "request": {
  "follow_redirect": false,
  "page_id": 1505283,
  "render": true,
  "revision_id": null,
  "title": null,
  "wiki": "en"
 },
 "schema": "urn:citerift:schema:wiki:v1:capture",
 "schema_version": "1.0.0",
 "source": {
  "artifact": "45e359f8ec78637702c68c299be5b3481ca6f989ebd9dd125d03efc1f65e6a3b",
  "bytes": 50895,
  "response_artifact": "bd3f978dc87311ad60a9478e1e6612f9d9e41b83023507b3a1f10015ca80e205",
  "url": "https://en.wikipedia.org/w/api.php?action=query&format=json&formatversion=2&prop=revisions%7Cinfo&rvprop=ids%7Ctimestamp%7Cflags%7Csize%7Csha1%7Ccontentmodel%7Ccontent&rvslots=main&maxlag=5&pageids=1505283"
 },
 "started_at": "2026-10-29T08:53:11.712676Z",
 "status": "complete"
}
