{
 "attempts": [
  {
   "body_bytes": 44163,
   "body_sha256": "cf795fef5f1c8e5b07c425cef52f4677dba58c1dcc618bcd3194714052d6f4bb",
   "code": null,
   "content_type": "application/json; charset=utf-8",
   "detail": "",
   "duration_s": 0.517,
   "number": 1,
   "operation": "source",
   "retry_after_problem": null,
   "retry_after_raw": null,
   "retry_after_s": null,
   "retryable": false,
   "started_at": "2026-10-29T09:27:00.294292Z",
   "status": 200,
   "url": "https://en.wikipedia.org/w/api.php?action=query&format=json&formatversion=2&prop=revisions%7Cinfo&rvprop=ids%7Ctimestamp%7Cflags%7Csize%7Csha1%7Ccontentmodel%7Ccontent&rvslots=main&maxlag=5&revids=1374726997",
   "wire_bytes": 16017
  },
  {
   "body_bytes": 292011,
   "body_sha256": "3cd648a3b4e1516d8b1332000720105c23281f5badb00da0d64eef8646b643c4",
   "code": null,
   "content_type": "text/html; charset=utf-8; profile=\"https://www.mediawiki.org/wiki/Specs/HTML/2.8.0\"",
   "detail": "",
   "duration_s": 0.491,
   "number": 1,
   "operation": "render",
   "retry_after_problem": null,
   "retry_after_raw": null,
   "retry_after_s": null,
   "retryable": false,
   "started_at": "2026-10-29T09:28:00.253320Z",
   "status": 200,
   "url": "https://en.wikipedia.org/w/rest.php/v1/revision/1374726997/html",
   "wire_bytes": 49593
  }
 ],
 "client": {
  "name": "citerift-wiki",
  "policy": {
   "backoff_s": 10.0,
   "deadline_s": 180.0,
   "max_attempts": 3,
   "max_body_bytes": 33554432,
   "max_wire_bytes": 33554432,
   "maxlag_s": 5,
   "min_interval_s": 10.0,
   "op_timeout_s": 30.0,
   "user_agent": "CITERIFT-wiki/1.0 (https://github.com/ImanOthman-eng/citerift; read-only research; contact via GitHub issues)"
  },
  "version": "1.0.0"
 },
 "failure_artifacts": [],
 "finished_at": "2026-10-29T09:28:00.748063Z",
 "issues": [],
 "not_before": null,
 "page": {
  "content_model": "wikitext",
  "host": "en.wikipedia.org",
  "is_latest": true,
  "namespace": 0,
  "page_id": 29856330,
  "parent_revision_id": 1363704655,
  "redirect_followed": null,
  "revision_id": 1374726997,
  "revision_timestamp": "2026-09-13T19:55:09Z",
  "sha1": "1acec1c3bd3a99de1ec9273531b690e59d53cbe7",
  "size": 43137,
  "title": "GFAJ-1",
  "wiki": "en"
 },
 "render": {
  "artifact": "3cd648a3b4e1516d8b1332000720105c23281f5badb00da0d64eef8646b643c4",
  "bytes": 292011,
  "checks": {
   "document_revision_id": "1374726997",
   "header_revision_id": "1374726997",
   "html_version": "2.8.0",
   "namespace": "0",
   "page_id": "29856330",
   "render_id": "33c3ae77-d176-11f1-b26a-0de09eac0006",
   "revision_sha1": "1acec1c3bd3a99de1ec9273531b690e59d53cbe7",
   "revision_sha1_base36": "34qc32kvpei5oar6wakven45mla209z"
  },
  "headers": {
   "content-language": "en",
   "content-revision-id": "1374726997",
   "content-type": "text/html; charset=utf-8; profile=\"https://www.mediawiki.org/wiki/Specs/HTML/2.8.0\"",
   "date": "Thu, 29 Oct 2026 09:28:00 GMT",
   "etag": "W/\"1374726997/33c3ae77-d176-11f1-b26a-0de09eac0006/view\"",
   "last-modified": "Mon, 26 Oct 2026 19:47:09 GMT"
  },
  "state": "captured",
  "url": "https://en.wikipedia.org/w/rest.php/v1/revision/1374726997/html"
 },
 "request": {
  "follow_redirect": false,
  "page_id": null,
  "render": true,
  "revision_id": 1374726997,
  "title": null,
  "wiki": "en"
 },
 "schema": "urn:citerift:schema:wiki:v1:capture",
 "schema_version": "1.0.0",
 "source": {
  "artifact": "a13ed96e91034a7a39b9a5963d2212fb1be33199b6dae8eec40f56869b33b45f",
  "bytes": 43137,
  "response_artifact": "cf795fef5f1c8e5b07c425cef52f4677dba58c1dcc618bcd3194714052d6f4bb",
  "url": "https://en.wikipedia.org/w/api.php?action=query&format=json&formatversion=2&prop=revisions%7Cinfo&rvprop=ids%7Ctimestamp%7Cflags%7Csize%7Csha1%7Ccontentmodel%7Ccontent&rvslots=main&maxlag=5&revids=1374726997"
 },
 "started_at": "2026-10-29T09:26:12.474379Z",
 "status": "complete"
}
