{
 "attempts": [
  {
   "body_bytes": 21150,
   "body_sha256": "7d2a5b92515cb400859c161845f1836c844c55af619de433d754ae73e3db3921",
   "code": null,
   "content_type": "application/json; charset=utf-8",
   "detail": "",
   "duration_s": 0.0,
   "number": 1,
   "operation": "source",
   "retry_after_problem": null,
   "retry_after_raw": null,
   "retry_after_s": null,
   "retryable": false,
   "started_at": "2026-10-28T18:00:00.000000Z",
   "status": 200,
   "url": "https://en.wikipedia.org/w/api.php?action=query&format=json&formatversion=2&prop=revisions%7Cinfo&rvprop=ids%7Ctimestamp%7Cflags%7Csize%7Csha1%7Ccontentmodel%7Ccontent&rvslots=main&maxlag=5&revids=1372543632",
   "wire_bytes": 21150
  },
  {
   "body_bytes": 116074,
   "body_sha256": "4a12e078ec88d97a4b4673596fb139b12e4a79499a726c2a789f3e4c91597763",
   "code": null,
   "content_type": "text/html; charset=utf-8; profile=\"https://www.mediawiki.org/wiki/Specs/HTML/2.8.0\"",
   "detail": "",
   "duration_s": 0.0,
   "number": 1,
   "operation": "render",
   "retry_after_problem": null,
   "retry_after_raw": null,
   "retry_after_s": null,
   "retryable": false,
   "started_at": "2026-10-28T18:00:10.000000Z",
   "status": 200,
   "url": "https://en.wikipedia.org/w/rest.php/v1/revision/1372543632/html",
   "wire_bytes": 116074
  }
 ],
 "client": {
  "name": "citerift-wiki",
  "policy": {
   "backoff_s": 10.0,
   "deadline_s": 180.0,
   "max_attempts": 3,
   "max_body_bytes": 33554432,
   "max_wire_bytes": 33554432,
   "maxlag_s": 5,
   "min_interval_s": 10.0,
   "op_timeout_s": 30.0,
   "user_agent": "CITERIFT-wiki/1.0 (https://github.com/ImanOthman-eng/citerift; read-only research; contact via GitHub issues)"
  },
  "version": "1.0.0"
 },
 "failure_artifacts": [],
 "finished_at": "2026-10-28T18:00:10.000000Z",
 "issues": [],
 "not_before": null,
 "page": {
  "content_model": "wikitext",
  "host": "en.wikipedia.org",
  "is_latest": true,
  "namespace": 0,
  "page_id": 41787575,
  "parent_revision_id": 1361270838,
  "redirect_followed": null,
  "revision_id": 1372543632,
  "revision_timestamp": "2026-09-01T04:41:51Z",
  "sha1": "9510652efbb374fcefc0343090b110942348fc6b",
  "size": 20444,
  "title": "Haruko Obokata",
  "wiki": "en"
 },
 "render": {
  "artifact": "4a12e078ec88d97a4b4673596fb139b12e4a79499a726c2a789f3e4c91597763",
  "bytes": 116074,
  "checks": {
   "document_revision_id": "1372543632",
   "header_revision_id": "1372543632",
   "html_version": "2.8.0",
   "namespace": "0",
   "page_id": "41787575",
   "render_id": "048b6904-d264-11f1-ab1c-890b853c37e5",
   "revision_sha1": "9510652efbb374fcefc0343090b110942348fc6b",
   "revision_sha1_base36": "heuea4dam2gtra682xfhf0kb5quae7f"
  },
  "headers": {
   "content-revision-id": "1372543632",
   "content-type": "text/html; charset=utf-8; profile=\"https://www.mediawiki.org/wiki/Specs/HTML/2.8.0\"",
   "date": "Wed, 28 Oct 2026 18:29:02 GMT",
   "etag": "W/\"1372543632/048b6904-d264-11f1-ab1c-890b853c37e5/view\""
  },
  "state": "captured",
  "url": "https://en.wikipedia.org/w/rest.php/v1/revision/1372543632/html"
 },
 "request": {
  "follow_redirect": false,
  "page_id": null,
  "render": true,
  "revision_id": 1372543632,
  "title": null,
  "wiki": "en"
 },
 "schema": "urn:citerift:schema:wiki:v1:capture",
 "schema_version": "1.0.0",
 "source": {
  "artifact": "88da776f5847e822d9a87c456f92d22fbe6bf0cc816043ae818b91d6a40a2149",
  "bytes": 20444,
  "response_artifact": "7d2a5b92515cb400859c161845f1836c844c55af619de433d754ae73e3db3921",
  "url": "https://en.wikipedia.org/w/api.php?action=query&format=json&formatversion=2&prop=revisions%7Cinfo&rvprop=ids%7Ctimestamp%7Cflags%7Csize%7Csha1%7Ccontentmodel%7Ccontent&rvslots=main&maxlag=5&revids=1372543632"
 },
 "started_at": "2026-10-28T18:00:00.000000Z",
 "status": "complete"
}
