{
 "attempts": [
  {
   "body_bytes": 274,
   "body_sha256": "e39a3178ab2369423caa66ef949f25f2d7beb4adeda152b4993dce1bc4425033",
   "code": "HTTP_RATE_LIMITED",
   "content_type": "text/plain",
   "detail": "",
   "duration_s": 0.429,
   "number": 1,
   "operation": "source",
   "retry_after_problem": null,
   "retry_after_raw": "49",
   "retry_after_s": 49.0,
   "retryable": true,
   "started_at": "2026-10-29T08:22:11.138307Z",
   "status": 429,
   "url": "https://en.wikipedia.org/w/api.php?action=query&format=json&formatversion=2&prop=revisions%7Cinfo&rvprop=ids%7Ctimestamp%7Cflags%7Csize%7Csha1%7Ccontentmodel%7Ccontent&rvslots=main&maxlag=5&pageids=80310887",
   "wire_bytes": 274
  },
  {
   "body_bytes": 4493,
   "body_sha256": "5f7e74debb2d655ae5ea6cba1971e99213dbfb85f374ce37a7650dab6e26ea55",
   "code": null,
   "content_type": "application/json; charset=utf-8",
   "detail": "",
   "duration_s": 0.442,
   "number": 2,
   "operation": "source",
   "retry_after_problem": null,
   "retry_after_raw": null,
   "retry_after_s": null,
   "retryable": false,
   "started_at": "2026-10-29T08:23:00.567810Z",
   "status": 200,
   "url": "https://en.wikipedia.org/w/api.php?action=query&format=json&formatversion=2&prop=revisions%7Cinfo&rvprop=ids%7Ctimestamp%7Cflags%7Csize%7Csha1%7Ccontentmodel%7Ccontent&rvslots=main&maxlag=5&pageids=80310887",
   "wire_bytes": 1835
  },
  {
   "body_bytes": 274,
   "body_sha256": "3c06663df1315f45788947a9b5d8978efb8d91bdbffa1258ac628d22a685c62a",
   "code": "HTTP_RATE_LIMITED",
   "content_type": "text/plain",
   "detail": "",
   "duration_s": 0.431,
   "number": 1,
   "operation": "render",
   "retry_after_problem": null,
   "retry_after_raw": "49",
   "retry_after_s": 49.0,
   "retryable": true,
   "started_at": "2026-10-29T08:23:11.011149Z",
   "status": 429,
   "url": "https://en.wikipedia.org/w/rest.php/v1/revision/1372296421/html",
   "wire_bytes": 274
  },
  {
   "body_bytes": 40799,
   "body_sha256": "494a7ceb32e8ada32516a6dc7ccf30384bbd61329ff05d869d1b1c22b4326021",
   "code": null,
   "content_type": "text/html; charset=utf-8; profile=\"https://www.mediawiki.org/wiki/Specs/HTML/2.8.0\"",
   "detail": "",
   "duration_s": 0.486,
   "number": 2,
   "operation": "render",
   "retry_after_problem": null,
   "retry_after_raw": null,
   "retry_after_s": null,
   "retryable": false,
   "started_at": "2026-10-29T08:24:00.442571Z",
   "status": 200,
   "url": "https://en.wikipedia.org/w/rest.php/v1/revision/1372296421/html",
   "wire_bytes": 8614
  }
 ],
 "client": {
  "name": "citerift-wiki",
  "policy": {
   "backoff_s": 10.0,
   "deadline_s": 180.0,
   "max_attempts": 3,
   "max_body_bytes": 33554432,
   "max_wire_bytes": 33554432,
   "maxlag_s": 5,
   "min_interval_s": 10.0,
   "op_timeout_s": 30.0,
   "user_agent": "CITERIFT-wiki/1.0 (https://github.com/ImanOthman-eng/citerift; read-only research; contact via GitHub issues)"
  },
  "version": "1.0.0"
 },
 "failure_artifacts": [
  "e39a3178ab2369423caa66ef949f25f2d7beb4adeda152b4993dce1bc4425033",
  "3c06663df1315f45788947a9b5d8978efb8d91bdbffa1258ac628d22a685c62a"
 ],
 "finished_at": "2026-10-29T08:24:00.930055Z",
 "issues": [],
 "not_before": null,
 "page": {
  "content_model": "wikitext",
  "host": "en.wikipedia.org",
  "is_latest": true,
  "namespace": 0,
  "page_id": 80310887,
  "parent_revision_id": 1353903645,
  "redirect_followed": null,
  "revision_id": 1372296421,
  "revision_timestamp": "2026-08-31T04:23:47Z",
  "sha1": "f9e958bf9e2470f45efcd33701b864f5eaf8c20a",
  "size": 3897,
  "title": "Margaret Wooster Curti",
  "wiki": "en"
 },
 "render": {
  "artifact": "494a7ceb32e8ada32516a6dc7ccf30384bbd61329ff05d869d1b1c22b4326021",
  "bytes": 40799,
  "checks": {
   "document_revision_id": "1372296421",
   "header_revision_id": "1372296421",
   "html_version": "2.8.0",
   "namespace": "0",
   "page_id": "80310887",
   "render_id": "d5eab9e5-d34f-11f1-a4b8-81feac1b9f58",
   "revision_sha1": "f9e958bf9e2470f45efcd33701b864f5eaf8c20a",
   "revision_sha1_base36": "t6xf1qkjfmsudx04bthhpe9pj7hwidm"
  },
  "headers": {
   "content-language": "en",
   "content-revision-id": "1372296421",
   "content-type": "text/html; charset=utf-8; profile=\"https://www.mediawiki.org/wiki/Specs/HTML/2.8.0\"",
   "date": "Thu, 29 Oct 2026 08:24:00 GMT",
   "etag": "W/\"1372296421/d5eab9e5-d34f-11f1-a4b8-81feac1b9f58/view\"",
   "last-modified": "Mon, 26 Oct 2026 20:15:42 GMT"
  },
  "state": "captured",
  "url": "https://en.wikipedia.org/w/rest.php/v1/revision/1372296421/html"
 },
 "request": {
  "follow_redirect": false,
  "page_id": 80310887,
  "render": true,
  "revision_id": null,
  "title": null,
  "wiki": "en"
 },
 "schema": "urn:citerift:schema:wiki:v1:capture",
 "schema_version": "1.0.0",
 "source": {
  "artifact": "20d6d4a8ae682925bf2d3d52cf7696c43196afeebfd5f908441a41fa3d6d4fee",
  "bytes": 3897,
  "response_artifact": "5f7e74debb2d655ae5ea6cba1971e99213dbfb85f374ce37a7650dab6e26ea55",
  "url": "https://en.wikipedia.org/w/api.php?action=query&format=json&formatversion=2&prop=revisions%7Cinfo&rvprop=ids%7Ctimestamp%7Cflags%7Csize%7Csha1%7Ccontentmodel%7Ccontent&rvslots=main&maxlag=5&pageids=80310887"
 },
 "started_at": "2026-10-29T08:22:01.437143Z",
 "status": "complete"
}
