{
 "attempts": [
  {
   "body_bytes": 70574,
   "body_sha256": "250b846b3d5df6c942367c3c7f56d40763044441567ad8e710169686223d1b35",
   "code": null,
   "content_type": "application/json; charset=utf-8",
   "detail": "",
   "duration_s": 0.42,
   "number": 1,
   "operation": "source",
   "retry_after_problem": null,
   "retry_after_raw": null,
   "retry_after_s": null,
   "retryable": false,
   "started_at": "2026-10-30T20:55:49.801258Z",
   "status": 200,
   "url": "https://en.wikipedia.org/w/api.php?action=query&format=json&formatversion=2&prop=revisions%7Cinfo&rvprop=ids%7Ctimestamp%7Cflags%7Csize%7Csha1%7Ccontentmodel%7Ccontent&rvslots=main&maxlag=5&pageids=140444",
   "wire_bytes": 27282
  },
  {
   "body_bytes": 289479,
   "body_sha256": "27a5ce9fa8c85a17bb0b39872704d15a3dc6f54fd4c4f67ee4a96a6867a08022",
   "code": null,
   "content_type": "text/html; charset=utf-8; profile=\"https://www.mediawiki.org/wiki/Specs/HTML/2.8.0\"",
   "detail": "",
   "duration_s": 0.451,
   "number": 1,
   "operation": "render",
   "retry_after_problem": null,
   "retry_after_raw": null,
   "retry_after_s": null,
   "retryable": false,
   "started_at": "2026-10-30T20:56:00.225578Z",
   "status": 200,
   "url": "https://en.wikipedia.org/w/rest.php/v1/revision/1381782708/html",
   "wire_bytes": 63096
  }
 ],
 "client": {
  "name": "citerift-wiki",
  "policy": {
   "backoff_s": 10.0,
   "deadline_s": 180.0,
   "max_attempts": 3,
   "max_body_bytes": 33554432,
   "max_wire_bytes": 33554432,
   "maxlag_s": 5,
   "min_interval_s": 10.0,
   "op_timeout_s": 30.0,
   "user_agent": "CITERIFT-wiki/1.0 (https://github.com/ImanOthman-eng/citerift; read-only research; contact via GitHub issues)"
  },
  "version": "1.0.0"
 },
 "failure_artifacts": [],
 "finished_at": "2026-10-30T20:56:00.679161Z",
 "issues": [],
 "not_before": null,
 "page": {
  "content_model": "wikitext",
  "host": "en.wikipedia.org",
  "is_latest": true,
  "namespace": 0,
  "page_id": 140444,
  "parent_revision_id": 1380656892,
  "redirect_followed": null,
  "revision_id": 1381782708,
  "revision_timestamp": "2026-10-24T19:58:54Z",
  "sha1": "2cf91d4342289b80e7a844b18dc710d0e00738c4",
  "size": 69564,
  "title": "A. J. P. Taylor",
  "wiki": "en"
 },
 "render": {
  "artifact": "27a5ce9fa8c85a17bb0b39872704d15a3dc6f54fd4c4f67ee4a96a6867a08022",
  "bytes": 289479,
  "checks": {
   "document_revision_id": "1381782708",
   "header_revision_id": "1381782708",
   "html_version": "2.8.0",
   "namespace": "0",
   "page_id": "140444",
   "render_id": "d6e6187a-d415-11f1-82dd-7392c54932dc",
   "revision_sha1": "2cf91d4342289b80e7a844b18dc710d0e00738c4",
   "revision_sha1_base36": "594crmvjbp44uvutypxjiy1prb669qc"
  },
  "headers": {
   "content-language": "en",
   "content-revision-id": "1381782708",
   "content-type": "text/html; charset=utf-8; profile=\"https://www.mediawiki.org/wiki/Specs/HTML/2.8.0\"",
   "date": "Fri, 30 Oct 2026 20:56:00 GMT",
   "etag": "W/\"1381782708/d6e6187a-d415-11f1-82dd-7392c54932dc/view\"",
   "last-modified": "Fri, 30 Oct 2026 03:49:59 GMT"
  },
  "state": "captured",
  "url": "https://en.wikipedia.org/w/rest.php/v1/revision/1381782708/html"
 },
 "request": {
  "follow_redirect": false,
  "page_id": 140444,
  "render": true,
  "revision_id": null,
  "title": null,
  "wiki": "en"
 },
 "schema": "urn:citerift:schema:wiki:v1:capture",
 "schema_version": "1.0.0",
 "source": {
  "artifact": "8ebfbd2c9d045382901c54963460bc3d28ef719c34a3fcfdb76b899a0abffe4e",
  "bytes": 69564,
  "response_artifact": "250b846b3d5df6c942367c3c7f56d40763044441567ad8e710169686223d1b35",
  "url": "https://en.wikipedia.org/w/api.php?action=query&format=json&formatversion=2&prop=revisions%7Cinfo&rvprop=ids%7Ctimestamp%7Cflags%7Csize%7Csha1%7Ccontentmodel%7Ccontent&rvslots=main&maxlag=5&pageids=140444"
 },
 "started_at": "2026-10-30T20:55:40.166059Z",
 "status": "complete"
}
